Data;Ora;Luogo;Feriti;Tipo Sinistro;Latitudine;Longitudine
04/07/2022;01:15;VIA PECORAINO FILIPPO pressi INGHAM;0;C;38,095486;13,397772
04/07/2022;09:05;VIALE REGIONE SICILIANA N.O. carr. laterale -;1;F;38,153339;13,320489
04/07/2022;09:15;VIALE REGIONE SICILIANA N.O. altezza 1534;0;C;38,119791;13,328477
04/07/2022;14:30;VIALE VENERE pressi n? civico 25;1;F;38,189717;13,329036
04/07/2022;14:45;VIA CELONA s.n.c.;1;F;38,137003;13,299925
04/07/2022;16:00;VIA BRASA altezza CIV. 42;0;C;38,10753;13,353782
04/07/2022;18:00;VIALE LEONARDO DA VINCI altezza del civico 637D;2;F;38,126765;13,310953
04/07/2022;19:30;VIALE REGIONE SICILIANA N.O. altezza del civico 1618;1;F;38,11933;13,328965
04/07/2022;19:45;VIA CALTANISSETTA intersezione VIA PRINCIPE DI VILLAFRANCA;1;F;38,12861;13,349863
04/07/2022;20:30;VIA BELLOLAMPO altezza STR. PROV. 1;0;C;38,137459;13,276135
04/07/2022;22:10;VIA MORSO SALVATORE intersezione VIA DEL VESPRO;1;F;38,10697;13,362303
05/07/2022;02:00;VIA GIRARDENGO COSTANTE nr. 9;0;C;38,178231;13,316611
05/07/2022;04:00;VIA CASSARI altezza del civico 15;0;C;38,118608;13,366535
05/07/2022;05:00;VIALE DIANA altezza CASA NATURA;0;C;38,166455;13,339321
05/07/2022;08:10;VIALE STRASBURGO intersezione VIA INGEGNEROS GIUSEPPE;1;F;38,157989;13,325401
05/07/2022;09:40;VIALE DELL'OLIMPO intersezione VIA CHIRONE;1;F;38,189138;13,308388
05/07/2022;10:00;VIA LANZA DI SCALEA GIUSEPPE altezza (spec.) Rubino;1;F;38,182854;13,304094
05/07/2022;13:50;VIA UDITORE nr. 14/c;2;F;38,131227;13,324433
05/07/2022;18:45;VIA DEI CANTIERI intersezione VIA MARVUGLIA VENANZIO;2;F;38,1365;13,360986
05/07/2022;22:45;VIA TERRANOVA CESARE altezza del civico 65;1;M;38,09698;13,321079
05/07/2022;23:00;VIA CARTA GIUSEPPE di fronte .;0;C;38,163275;13,325578
06/07/2022;00:30;VIA DEI CANTIERI intersezione PIAZZA CAPONNETTO ANTONINO;0;C;38,135905;13,358511
06/07/2022;04:40;VIALE REGIONE SICILIANA N.O. altezza (spec.) .;1;F;38,138887;13,331189
06/07/2022;06:50;VIA MESSINA MARINE altezza (spec.) P.ZZA SPERONE;1;F;38,098749;13,405921
06/07/2022;11:00;VIA PECORI GIRALDI GUGLIELMO M intersezione con VIALE XXVII MAGGIO;0;C;38,095765;13,40378
06/07/2022;11:15;VIALE REGIONE SICILIANA S.E. direzione DIR. CATANIA CORSO CALATAFIMI;1;F;38,102929;13,330306
06/07/2022;11:46;CORSO TUKORY altezza del civico 145;0;C;38,108748;13,358986
06/07/2022;14:00;VIALE VENERE altezza (spec.) 18;1;F;38,189182;13,324904
06/07/2022;14:10;PIAZZA LEONI altezza del civico 9;2;F;38,146976;13,343558
06/07/2022;16:30;PIAZZA CAPPUCCINI di fronte al civico 1;0;C;38,11144;13,339323
06/07/2022;18:25;CORSO DEI MILLE intersezione VIALE AMEDEO D'AOSTA;1;F;38,100563;13,38366
06/07/2022;19:30;VIA MESSINA MARINE altezza del civico 311;1;F;38,104621;13,390338
06/07/2022;22:20;PIAZZA VALDESI altezza (inters.) VIALE MARGHERITA DI SAVOIA;1;F;38,196521;13,331835
07/07/2022;02:00;VIALE DUCA DEGLI ABRUZZI altezza del civico 4/A;0;C;38,169034;13,328388
07/07/2022;03:20;VIA MARINUZZI GINO intersezione VIA DICILLO ROCCO;0;C;38,102818;13,33643
07/07/2022;06:30;VIA RUTELLI MARIO intersezione VIA DE AMICIS EDMONDO;0;C;38,139376;13,347775
07/07/2022;08:50;VIALE MARGHERITA DI SAVOIA altezza fermata bus;2;F;38,193572;13,332282
07/07/2022;10:30;VIA MALASPINA altezza del civico 57;1;F;38,12527;13,346277
07/07/2022;12:40;VIA DANTE intersezione VIA DE SPUCHES GIUSEPPE;1;F;38,123929;13,351502
07/07/2022;13:30;VIALE CAMPANIA di fronte al civico 31B;1;F;38,145541;13,338811
07/07/2022;15:20;VIALE REGIONE SICILIANA S.E. intersezione VIA ROSSO DI S.SECONDO;1;F;38,120412;13,329083
07/07/2022;16:40;VIA DANTE intersezione VIA PRINCIPE DI VILLAFRANCA;0;C;38,124142;13,352426
07/07/2022;17:30;VIALE REGIONE SICILIANA pressi VIA LA LOGGIA;0;C;38,106566;13,330448
07/07/2022;23:50;VIA PITRE' GIUSEPPE altezza del civico 260;0;C;38,110079;13,318934
08/07/2022;02:50;VIA LA FARINA GIUSEPPE intersezione PIAZZA MORDINI ANTONIO;1;F;38,129764;13,351585
08/07/2022;07:00;VIA ALBANESE ENRICO nr. 17;0;C;38,130356;13,355501
08/07/2022;11:15;VIA GIUFFRE' LIBORIO altezza del civico 48/A;0;C;38,105678;13,361943
08/07/2022;13:35;CORSO TUKORY intersezione VIA PORTA S.AGATA;1;F;38,109267;13,361703
08/07/2022;14:35;VIA ROMA intersezione con VIA GUARDIONE FRANCESCO;1;F;38,122513;13,360458
08/07/2022;15:00;PIAZZA NOCE intersezione VIA DI BLASI E. GIOVANNI;0;C;38,121812;13,332949
08/07/2022;19:00;VIA BRIGATA AOSTA intersezione VIA COSTANZO AURELIO;0;M;38,1355;13,360475
09/07/2022;09:00;VIA MESSINA MARINE altezza del civico 213;1;F;38,106185;13,386532
09/07/2022;15:40;VIALE LAZIO intersezione VIA ZAPPALA' GIOVANNI;1;F;38,140787;13,334146
09/07/2022;17:20;VIA ALAJMO MICHELE a mt. 40 via Marciano;1;F;38,184294;13,316695
10/07/2022;01:30;VIA TOMMASO NATALE altezza del civico 131;0;C;38,183611;13,292479
10/07/2022;04:00;VIA SABOTINO intersezione con VIA PASUBIO;0;C;38,142248;13,343132
10/07/2022;08:30;CORTILE VASSALLO (V PANTELLERIA) pressi -;0;C;38,159288;13,322173
10/07/2022;10:00;VIALE REGIONE SICILIANA S.E. s.n.c.;3;F;38,123831;13,329406
10/07/2022;19:00;VIA CARELLA nr. 57;0;C;38,123427;13,360649
10/07/2022;19:45;LUNGOMARE COLOMBO CRISTOFORO pressi 2105;1;F;38,183746;13,363846
10/07/2022;23:25;VIA ROMA di fronte al civico 148;2;F;38,114675;13,3645
11/07/2022;08:00;VIA RESTIVO EMPEDOCLE intersezione VIALE EMILIA;0;C;38,145349;13,335278
11/07/2022;10:10;PIAZZA PRINCIPE DI CAMPOREALE altezza del civico 16;1;F;38,119441;13,341566
11/07/2022;14:30;LARGO HARRIS PAUL di fronte al civico 228;0;C;38,137817;13,338425
11/07/2022;15:20;VIA MONTE MARIO intersezione con VIA NEBRODI(DEI);1;F;38,15245;13,327607
11/07/2022;16:20;VIA CAVOUR CAMILLO di fronte al civico 2;1;F;38,122405;13,36234
11/07/2022;17:05;VIA GUALTIERO DA CALTAGIRONE intersezione VIA MARGHERITO DA BRINDISI;1;F;38,189407;13,344937
11/07/2022;20:10;VIA MESSINA MARINE altezza del civico 193;0;C;38,106695;13,384398
11/07/2022;21:15;VIA PLAUTO pressi 27;0;C;38,200638;13,268889
12/07/2022;04:20;VIA PARTANNA MONDELLO altezza del civico 31;2;F;38,189614;13,290785
12/07/2022;09:15;VIA DANTE intersezione con VIA PRINCIPE DI VILLAFRANCA;1;F;38,124147;13,352386
12/07/2022;10:00;VIA GARZILLI NICCOLO' intersezione VIA CARDUCCI GIOSUE';0;C;38,124816;13,353125
12/07/2022;10:45;VIA CRISPI FRANCESCO altezza staz giacheri;0;C;38,133949;13,35887
12/07/2022;14:00;VIA PISANO LEONARDO altezza del civico 30;1;F;38,177824;13,313302
12/07/2022;16:40;VIA NENNI PIETRO altezza (inters.) VIALE FRANCIA;0;C;38,154021;13,321065
13/07/2022;09:40;PIAZZA LEONI intersezione con VIA DELL'ARTIGLIERE;1;F;38,146775;13,343767
13/07/2022;10:15;PIAZZA LEONI altezza del civico 35;0;C;38,146656;13,344002
13/07/2022;11:15;VIA MESSINA MARINE nr. 813;1;F;38,095014;13,433164
13/07/2022;14:30;VIA NOTARBARTOLO EMANUELE intersezione VIA MORELLO NUNZIO;1;F;38,132355;13,34441
13/07/2022;18:30;CORSO DEI MILLE intersezione con VIA S.ALBERTO DEGLI ABATI;1;F;38,096087;13,399522
13/07/2022;23:45;VIA TASCA LANZA altezza del civico 98;0;C;38,112503;13,329264
14/07/2022;01:15;VIALE NICOLETTI ROSARIO altezza ENI;2;F;38,1889;13,297834
14/07/2022;03:10;VIA ROMA intersezione con VIA CAVOUR CAMILLO;0;C;38,121973;13,360805
14/07/2022;08:05;PIAZZA TUMMINELLO VINCENZO altezza del civico 3;0;C;38,112825;13,378011
14/07/2022;08:20;VIA DELL'ORSA MINORE intersezione VIA S.MARIA DI GESU';2;F;38,096359;13,370602
14/07/2022;08:30;VIA PALMERINO di fronte al civico 69;0;C;38,091822;13,323318
14/07/2022;09:50;VIALE MICHELANGELO di fronte al civico 116;1;F;38,139283;13,32902
14/07/2022;11:20;PIAZZA VALDESI intersezione con VIALE REGINA ELENA;1;F;38,19723;13,331427
14/07/2022;13:50;VIA PIANO DELL'UCCIARDONE altezza (spec.) CARCERE;1;F;38,133153;13,359356
14/07/2022;15:05;VIA PRINCIPE DI VILLAFRANCA intersezione VIA FERRARA FRANCESCO;1;F;38,125604;13,351565
14/07/2022;17:15;VIA BACILE GIOVANNI MONS. intersezione con VIA PECORI GIRALDI GUGLIELMO M;1;F;38,097108;13,400015
14/07/2022;17:30;VIALE REGIONE SICILIANA S.E. di fronte al civico 1564;0;C;38,092508;13,341055
14/07/2022;17:30;VIALE REGIONE SICILIANA altezza del civico 1175;1;F;38,113849;13,329667
14/07/2022;19:37;VIA ROMA intersezione con VIA PRINCIPE DI BELMONTE;1;F;38,124592;13,359006
14/07/2022;21:00;VIA CIACULLI altezza del civico 12;1;R;38,085276;13,393585
15/07/2022;03:20;VIALE REGIONE SICILIANA N.O. intersezione con VIA TRABUCCO;0;C;38,155304;13,3178
15/07/2022;08:00;VIA SAMPOLO altezza del civico 162;0;C;38,137405;13,354084
15/07/2022;09:45;VIA DUCA DELLA VERDURA altezza (inters.) VIA FRA GIOVANNI PANTALEO;0;C;38,134863;13,35433
15/07/2022;17:10;VIA S.FILIPPO nr. 40;1;F;38,091968;13,361388
15/07/2022;17:45;CORSO TUKORY intersezione VIA AVOLIO CORRADO;1;F;38,10905;13,36049
15/07/2022;18:20;VIALE DELL'OLIMPO altezza del civico 1;0;C;38,18901;13,320504
15/07/2022;21:30;VIA LA FERLA FRANCESCO GEN. intersezione con VIA DIAZ ARMANDO M.LLO;1;F;38,101144;13,393617
16/07/2022;03:45;VIA PECORAINO FILIPPO altezza (inters.) VIA INGHAM;0;C;38,095443;13,397803
16/07/2022;08:45;VIA PIGNATELLI ARAGONA altezza P.ZZA VERDI;1;F;38,120752;13,356883
16/07/2022;09:55;VIA BORDONARO altezza cap AMAT;0;C;38,165482;13,368277
16/07/2022;13:10;VIALE CAMPANIA nr. 29/F;1;F;38,145297;13,338933
16/07/2022;18:30;VIA PIANO DELL'UCCIARDONE di fronte ARSENALE;1;F;38,134167;13,358751
16/07/2022;21:00;VIA DEI BARCAIUOLI nr. 33/a;1;F;38,199618;13,277388
16/07/2022;23:40;VIA TURRISI NICOLO' altezza -;1;F;38,120125;13,352432
17/07/2022;00:15;VIA ROMA nr. 161;0;C;38,115249;13,364077
17/07/2022;00:50;VIA PRINCIPE DI BELMONTE intersezione con VIA AMARI MICHELE;1;F;38,12489;13,359685
17/07/2022;01:30;VIALE DELLA RESURREZIONE di fronte al civico 29;5;F;38,17002;13,324899
17/07/2022;02:45;VIALE GALILEO GALILEI intersezione con VIA PRINCIPE DI PATERNO';3;F;38,136373;13,332602
17/07/2022;03:00;VIA MESSINA MARINE intersezione con VIA LAUDICINA ANTONINO;3;F;38,097718;13,413147
17/07/2022;09:20;VIALE MICHELANGELO nr. 1442;1;F;38,135458;13,314918
17/07/2022;11:30;VIALE REGIONE SICILIANA N.O. altezza LA MALFA;1;F;38,156475;13,317101
17/07/2022;17:00;VIA LO GRECO DAMIANO nr. 16;0;C;38,083206;13,363104
17/07/2022;18:00;CORSO PISANI PIETRO nr. 182;0;C;38,107191;13,347443
17/07/2022;21:00;VIA ALESSI GIUSEPPE nr. 61;1;F;38,140867;13,351669
17/07/2022;23:00;VIA ARCHIMEDE intersezione con VIA BASSI UGO;3;F;38,129266;13,356146
18/07/2022;01:10;VIA DEI QUARTIERI di fronte al civico 104;1;F;38,163394;13,329858
18/07/2022;09:30;VIA MONGITORE ANTONINO intersezione con VIA CADORNA LUIGI GEN.;1;F;38,109989;13,35623
18/07/2022;15:30;VIALE REGIONE SICILIANA S.E. nr. 8441;1;F;38,085697;13,420316
18/07/2022;16:00;CORSO CALATAFIMI nr. 404;1;F;38,103907;13,33238
18/07/2022;16:10;VIA BALSANO SALESIO intersezione con PIAZZA ORLANDO VITTORIO EMANUELE;1;F;38,119649;13,353172
18/07/2022;18:30;VIA PORRETTI nr. 10;0;C;38,142792;13,358468
18/07/2022;22:10;VIA CAPPELLO SALVATORE intersezione CORSO DEI MILLE;1;F;38,103227;13,378636
18/07/2022;23:40;VIA CONTE FEDERICO intersezione VIA GIAFAR EMIRO;0;C;38,092849;13,386812
19/07/2022;07:30;VIALE REGIONE SICILIANA N.O. altezza piazzale Giotto;2;F;38,132076;13,330461
19/07/2022;09:35;VIA BASILE ERNESTO nr. 108;0;C;38,104934;13,351115
19/07/2022;11:00;PIAZZA GIULIO CESARE di fronte via F.Maurolico;1;F;38,109996;13,365641
19/07/2022;17:30;PIAZZA UNITA' D'ITALIA intersezione con VIA GIUSTI GIUSEPPE;0;C;38,13737;13,344541
19/07/2022;19:00;VIA CALA di fronte -;0;C;38,118704;13,366182
20/07/2022;07:50;CORSO DEI MILLE s.n.c.;1;F;38,107709;13,371735
20/07/2022;08:15;FORO UMBERTO I altezza Porta Felice;0;C;38,119739;13,371415
20/07/2022;08:50;VIA DELLA LIBERTA' intersezione VIA LA FARINA GIUSEPPE;0;C;38,128946;13,349642
20/07/2022;08:50;VIA DELLA LIBERTA' altezza (inters.) VIA LA FARINA GIUSEPPE;1;F;38,128946;13,349642
20/07/2022;09:15;VIALE NICOLETTI ROSARIO nr. 25;1;F;38,190733;13,29187
20/07/2022;09:30;VIALE MICHELANGELO altezza del civico 884;1;F;38,136909;13,318324
20/07/2022;11:05;VIA TOSCANA intersezione VIA LIGURIA;2;F;38,144258;13,337048
20/07/2022;11:50;VIALE REGIONE SICILIANA altezza (spec.) st.Ponte Belgio;1;F;38,148445;13,326863
20/07/2022;12:15;VIALE REGIONE SICILIANA N.O. pressi 1890;0;C;38,120627;13,328552
20/07/2022;15:45;VIA BERNINI GIAN LORENZO altezza del civico 23;1;F;38,136825;13,322154
20/07/2022;17:00;VIA BARCARELLO altezza del civico 3B;1;F;38,201963;13,27687
21/07/2022;00:30;VIALE LAZIO in direzione di sovraponte VIALE MICHELANGELO;1;F;38,140266;13,331921
21/07/2022;03:00;VIA PECORAINO FILIPPO intersezione VIA INGHAM;0;C;38,095458;13,397677
21/07/2022;08:20;PIAZZA DELLA PACE altezza (spec.) Archimede;1;F;38,130761;13,359751
21/07/2022;08:30;VIA ROMA intersezione VIA LATTARINI GRANDE;1;F;38,115249;13,364358
21/07/2022;12:00;VIA DI BELLA AURELIO FRANCESCO di fronte VIA MADDALENA;0;C;38,095844;13,309632
21/07/2022;13:00;VIA DI STEFANO GIOVANNI intersezione VIA RUGGERI LEONARDO;0;C;38,12415238;13,318366
21/07/2022;18:10;PIAZZA EINSTEIN ALBERT intersezione VIALE REGIONE SICILIANA;0;C;38,128553;13,330002
21/07/2022;18:40;VIA GALLETTI nr. 293;1;F;38,087359;13,433031
22/07/2022;08:50;PIAZZALE BOLIVAR SIMON in prossimit? di civ. 10;1;F;38,188987;13,297364
22/07/2022;09:10;VIA GULI' SIMONE COM. intersezione VIA GIORDANO CALCEDONIO;1;F;38,141723;13,366892
22/07/2022;10:00;VIALE EURIDICE s.n.c.;0;C;38,192379;13,331204
22/07/2022;10:30;VIA DANTE nr. 170;2;F;38,122928;13,347278
22/07/2022;13:30;VIA BRASA pressi CIV. 42;1;F;38,107539;13,353793
22/07/2022;14:46;VIALE REGIONE SICILIANA N.O. di fronte 1571;5;F;38,117191;13,32922
22/07/2022;16:00;PIAZZA EINSTEIN ALBERT altezza CONFLUENZ  TP;1;F;38,12924;13,330093
22/07/2022;16:15;VIALE MARGHERITA DI SAVOIA nr. 66;1;F;38,190124;13,332801
22/07/2022;18:25;VIA MESSINA MARINE nr. 628;1;F;38,092295;13,444937
22/07/2022;18:45;VIALE PRINCIPESSA MAFALDA intersezione VIALE COLONIA MARINA;0;C;38,194044;13,335209
22/07/2022;19:18;VIA CALA di fronte al civico 5;0;C;38,119811;13,369966
22/07/2022;22:00;CORSO FINOCCHIARO APRILE CAMILLO nr. 32;1;F;38,118866;13,350085
22/07/2022;22:10;VIA ALBANESE ENRICO intersezione con VIA CORLEO SIMONE;3;F;38,129548;13,353478
23/07/2022;03:30;VIA BARACCA FRANCESCO nr. 98;0;C;38,109121;13,303211
23/07/2022;16:00;PIAZZALE BOLIVAR SIMON pressi civ. 9;1;F;38,189075;13,298636
23/07/2022;16:30;VIALE REGIONE SICILIANA di fronte al civico 2217;1;F;38,123288;13,329383
23/07/2022;17:30;VIA LINCOLN nr. 19;1;F;38,114107;13,373852
23/07/2022;18:00;VIA ALESSI GIUSEPPE intersezione VIA TOSELLI PIETRO MAGG.;1;F;38,140169;13,349913
23/07/2022;22:15;VIA MESSINA MARINE altezza del civico 627;1;F;38,097613;13,41598
24/07/2022;02:40;VIALE DEL FANTE intersezione VIALE ERCOLE;1;F;38,14715;13,343883
24/07/2022;02:45;VIA MARCONI GUGLIELMO intersezione con VIA SAMMARTINO;1;F;38,125409;13,349687
24/07/2022;04:30;VIA BERGAMO intersezione VIA GUADAGNA;2;F;38,102955;13,366106
24/07/2022;08:15;VIALE MARIA SS. MEDIATRICE intersezione VIALE REGIONE SICILIANA;0;C;38,100265;13,332094
24/07/2022;13:00;VIA LA MANTIA VITO intersezione VIA ZOPPO DI GANGI;0;C;38,121562;13,346176
24/07/2022;13:25;VIALE PRINCIPESSA IOLANDA intersezione VIALE COLONIA MARINA;1;F;38,194043;13,335223
24/07/2022;13:40;VIALE DELLE PALME intersezione VIALE PRINCIPESSA GIOVANNA;1;F;38,195587;13,336318
24/07/2022;18:10;PIAZZA TUMMINELLO VINCENZO altezza (inters.) VIA TIRO A SEGNO;0;C;38,112754;13,377673
24/07/2022;18:40;CORSO DEI MILLE nr. 120;0;C;38,110276;13,369507
24/07/2022;21:00;VIA PALMERINO intersezione VIA VINCI PIETRO;1;F;38,098402;13,334506
24/07/2022;22:45;VIA PECORAINO FILIPPO intersezione con VIA S.ALBERTO DEGLI ABATI;0;R;38,095107;13,399191
25/07/2022;07:40;VIA PITRE' GIUSEPPE nr. 220;1;F;38,110145;13,320051
25/07/2022;09:50;VIALE REGIONE SICILIANA nr. 1550;1;F;38,117319;13,328684
25/07/2022;15:50;VIA GOETHE altezza (inters.) VIA CLUVERIO;1;F;38,121433;13,350559
26/07/2022;07:50;CORSO TUKORY nr. 74;1;F;38,109348;13,362184
26/07/2022;08:00;VIALE REGIONE SICILIANA s.n.c.;1;F;38,087341;13,394593
26/07/2022;09:15;VIA DANTE di fronte al civico 94;0;C;38,123273;13,348759
26/07/2022;12:15;VIA TASCA LANZA altezza (spec.) FONDO DE CARO;0;C;38,106925;13,329851
26/07/2022;19:40;VIA GORGONE GIOVANNI nr. 47;0;C;38,146744;13,314758
27/07/2022;02:50;VIA LANZA DI SCALEA GIUSEPPE altezza 2780;0;C;38,188096;13,299754
27/07/2022;07:40;CORSO CALATAFIMI altezza (spec.) CIV. 745;0;C;38,102306;13,328353
27/07/2022;09:30;VIA DUCA DELLA VERDURA altezza del civico 84;0;C;38,135292;13,356075
27/07/2022;11:40;PIAZZA AMENDOLA GIOVANNI nr. 2;0;C;38,121792;13,351901
27/07/2022;14:40;VIA MOGIA altezza del civico 2b;0;C;38,117612;13,349047
27/07/2022;16:20;VIA ROMA intersezione VIA AMARI EMERICO;1;F;38,12543;13,358426
27/07/2022;17:00;VIALE NICOLETTI ROSARIO altezza (spec.) 50 mt imm. A29;1;F;38,191944;13,288978
27/07/2022;18:00;VIA SCINA' DOMENICO nr. 111;2;F;38,128353;13,3589
27/07/2022;19:40;VIALE LAZIO intersezione VIA TEVERE;1;F;38,141525;13,336188
27/07/2022;20:00;VIA LINCOLN nr. 151;2;F;38,111799;13,368899
27/07/2022;23:30;VIA BRUNELLESCHI FILIPPO intersezione con VIA BUONFORNELLO;1;F;38,138631;13,31389
28/07/2022;08:30;VIALE PERTINI SANDRO a mt. 80 v cannatella;1;F;38,181405;13,319071
28/07/2022;13:00;VIA CASTELLOTTI EUGENIO pressi R Marciano;0;C;38,18326;13,31437
28/07/2022;17:15;FORO UMBERTO I di fronte Padre Messina;1;F;38,11354;13,377642
28/07/2022;18:10;VIA BENTIVEGNA FRANCESCO nr. 62b;0;C;38,122831;13,359782
28/07/2022;20:30;VIALE REGIONE SICILIANA intersezione con VIA MADRE FLORENZIA PROFILIO;1;F;38,146825;13,327507
29/07/2022;03:00;VIA CALA altezza VIC. D. LUPA;0;C;38,119806;13,369917
29/07/2022;04:00;CORSO ALBERTO AMEDEO nr. 126;0;C;38,116436;13,350811
29/07/2022;07:55;VIA SERRADIFALCO intersezione VIA CASELLA ALFREDO;1;F;38,127227;13,337819
29/07/2022;08:05;VIA SERRADIFALCO in prossimit? di altezza;0;C;38,127292;13,337777
29/07/2022;12:20;VIA IANDOLINO LORENZO intersezione VIA CATALANO;0;C;38,197323;13,314587
29/07/2022;12:20;VIALE REGIONE SICILIANA N.O. nr. 474;0;C;38,107716;13,329846
29/07/2022;14:20;VIALE REGIONE SICILIANA N.O. s.n.c.;1;F;38,139261;13,330888
29/07/2022;17:20;PIAZZA INDIPENDENZA di fronte Pal. Orleans;1;F;38,110152;13,352793
29/07/2022;17:30;VIA RESUTTANA nr. 352;1;F;38,151658;13,336927
29/07/2022;19:00;VIA DEI QUARTIERI altezza del civico 100;1;F;38,162994;13,329025
29/07/2022;20:45;VIA ROMA intersezione con PIAZZA S.DOMENICO;1;F;38,118694;13,362646
30/07/2022;01:30;VIA PECORAINO FILIPPO in prossimit? di via S. CORLEONE;1;F;38,087984;13,406307
30/07/2022;01:30;VIA LANZA DI SCALEA GIUSEPPE altezza CONCA D'ORO;1;F;38,181216;13,30558
30/07/2022;02:30;VIA MONTEPELLEGRINO intersezione VIA DEI CANTIERI;1;F;38,135964;13,358681
30/07/2022;13:15;VIA FANARO ANTONIO intersezione VIA VIVIANO GIANCOLA;0;C;38,098772;13,368772
30/07/2022;13:40;VIA COPPI FAUSTO intersezione VIA ASCARI ALBERTO;1;F;38,180007;13,316715
30/07/2022;15:00;VIA DANTE intersezione VIA PRINCIPE DI VILLAFRANCA;1;F;38,124133;13,352418
30/07/2022;18:30;VIALE BRANDI CESARE intersezione con VIA PESCIA;0;C;38,185291;13,313745
30/07/2022;19:40;VIA MESSINA MARINE altezza del civico 648;1;F;38,089077;13,451019
30/07/2022;19:45;CORSO DEI MILLE intersezione VIALE AMEDEO D'AOSTA;1;F;38,100543;13,383679
30/07/2022;23:30;VIA DELLA LIBERTA' intersezione con PIAZZA MORDINI ANTONIO;1;F;38,129923;13,352016
31/07/2022;03:10;VIALE REGIONE SICILIANA N.O. intersezione VIA ALEO COSIMO;2;F;38,115618;13,329412
31/07/2022;04:40;VIA VAL DI MAZARA altezza del civico 52;0;C;38,149079;13,337297
31/07/2022;11:30;VIA TOMMASO NATALE intersezione PIAZZA MANDORLE;1;F;38,188014;13,288784
31/07/2022;14:00;PIAZZA NOCE di fronte al civico 2;0;C;38,122171;13,333482
31/07/2022;14:30;VIA PAZIENZA altezza del civico 41;1;F;38,201932;13,320287
31/07/2022;15:50;VIALE LAZIO intersezione con VIALE CAMPANIA;2;F;38,142941;13,340307
31/07/2022;20:40;VIA ALDISIO SALVATORE altezza del civico 33;1;F;38,155962;13,331087
01/08/2022;08:00;VIA LUTHER KING MARTIN di fronte al civico 13;0;C;38,147821;13,355572
01/08/2022;09:30;VIA DANTE intersezione VIA PRINCIPE DI VILLAFRANCA;1;F;38,12411;13,352459
01/08/2022;09:30;VIA RIZZO AMMIRAGLIO intersezione VIA JUNG GUIDO;0;C;38,143975;13,363109
01/08/2022;11:15;VIA PONTE DI MARE nr. 16;0;C;38,111624;13,378484
01/08/2022;11:45;VIA PARUTA FILIPPO nr. 10M;0;C;38,096665;13,318799
01/08/2022;16:35;PIAZZA EINSTEIN ALBERT altezza (inters.) VIALE REGIONE SICILIANA N.O.;1;F;38,153241;13,320421
01/08/2022;22:30;VIA PIETRO D'ARAGONA intersezione con VIA MURATORI LUDOVICO ANTONIO;1;F;38,107524;13,35807
02/08/2022;07:10;VIA MESSINA MARINE intersezione VIA ALBRICCI ALBERIGO GEN.;0;C;38,102493;13,395639
02/08/2022;08:15;PIAZZA GIOVANNI PAOLO II PAPA intersezione VIALE CROCE ROSSA;2;F;38,150639;13,33886
02/08/2022;12:30;VIALE REGIONE SICILIANA N.O. nr. 9135;1;F;38,175658;13,295912
02/08/2022;13:35;VIA LA MANTIA VITO intersezione con VIA ZOPPO DI GANGI;1;F;38,114668;13,340405
02/08/2022;15:45;VIA ERRANTE VINCENZO intersezione con VIA ORETO;1;F;38,108394;13,366177
02/08/2022;16:15;VIA BRUNELLESCHI FILIPPO di fronte al civico 17;1;F;38,139248;13,314075
02/08/2022;18:10;VIALE GALILEO GALILEI nr. 99;2;F;38,134066;13,333532
02/08/2022;18:30;VIALE REGIONE SICILIANA N.O. carr. centrale sottovia pitr?;2;F;38,110378;13,329966
02/08/2022;20:55;VIA MESSINA MARINE intersezione con VIA SAETTA ANTONINO;1;F;38,107795;13,381713
03/08/2022;01:10;VIA GULI' SIMONE COM. intersezione con SALITA BELMONTE;2;F;38,139637;13,367754
03/08/2022;10:45;VIALE MARGHERITA DI SAVOIA nr. 57;0;C;38,193178;13,332332
03/08/2022;12:40;CORSO CALATAFIMI di fronte al civico 51;1;F;38,111544;13,351252
03/08/2022;13:25;VIA PIGNATELLI ARAGONA nr. 13;0;C;38,120862;13,35644
03/08/2022;14:50;VIA BRASA altezza del civico 42;1;F;38,107457;13,353693
03/08/2022;15:22;VIA CALA di fronte S.M.D. CATENA;0;C;38,119682;13,369735
03/08/2022;16:00;VIALE REGIONE SICILIANA S.E. altezza (spec.) civ 4100;1;F;38,089983;13,373619
03/08/2022;17:00;VIALE LEONARDO DA VINCI altezza del civico 127;1;F;38,12977;13,333858
03/08/2022;17:02;VIALE DE GASPERI ALCIDE altezza del civico 42;0;C;38,150005;13,33558
03/08/2022;17:55;VIA PRINCIPE DI VILLAFRANCA intersezione con VIA NIGRA COSTANTINO;3;F;38,129425;13,349412
03/08/2022;18:00;VIALE STRASBURGO intersezione VIA PANTELLERIA;0;C;38,159963;13,323544
03/08/2022;21:15;PIAZZA MICCA PIETRO nr. 27;0;C;38,109245;13,309141
04/08/2022;00:08;VIA CORLEO SIMONE intersezione VIA ALBANESE ENRICO;0;C;38,129524;13,353517
04/08/2022;01:40;VIA DANTE intersezione VIA VENEZIANO ANTONIO;1;F;38,122285;13,344607
04/08/2022;07:40;VIALE REGIONE SICILIANA altezza del civico 2217BELLA;1;F;38,123307;13,329399
04/08/2022;12:25;VIALE REGIONE SICILIANA N.O. altezza BY PASS DI GIOR;1;F;38,125554;13,329102
04/08/2022;13:20;VIA TOSELLI PIETRO MAGG. intersezione VIA ARIMONDI GIUSEPPE GEN.;0;C;38,137;13,351981
04/08/2022;15:50;VIALE DEL FANTE nr. 66;1;F;38,15691;13,337576
04/08/2022;18:30;VIALE NICOLETTI ROSARIO nr. 24;2;F;38,191798;13,289679
04/08/2022;19:15;VIA TOSELLI PIETRO MAGG. intersezione con VIA ALESSI GIUSEPPE;0;C;38,140206;13,349883
04/08/2022;22:40;PIAZZA MICCA PIETRO di fronte CHIOSCO;0;C;38,109486;13,309125
05/08/2022;00:55;VIA CALA altezza -;1;F;38,119373;13,36925
05/08/2022;03:15;VIA MESSINA MARINE altezza VILLA CELSA;1;F;38,095421;13,432134
05/08/2022;07:50;VIA ROMA altezza del civico 7;0;C;38,120464;13,361718
05/08/2022;10:45;PIAZZA TOMMASO NATALE nr. 87;0;C;38,189565;13,286769
05/08/2022;12:30;CORSO CALATAFIMI intersezione con VIA POLLACI GIUSEPPE;1;F;38,102925;13,329904
05/08/2022;15:20;VIALE REGIONE SICILIANA S.E. di fronte C.C. PAGLIARELL;0;C;38,092551;13,340742
05/08/2022;15:50;VIALE REGIONE SICILIANA N.O. altezza del civico 5480;1;F;38,151684;13,32231
05/08/2022;18:00;VIALE REGIONE SICILIANA N.O. altezza (spec.) via PAGANO;0;C;38,10542;13,330368
05/08/2022;22:30;VIALE PRINCIPE DI SCALEA nr. 39;0;C;38,199111;13,327752
05/08/2022;23:00;LUNGOMARE COLOMBO CRISTOFORO nr. 5356;0;C;38,195792;13,338617
06/08/2022;03:10;VIA DALLA CHIESA C. A. GEN. altezza del civico 40;0;C;38,132776;13,353342
06/08/2022;09:45;VIALE DE GASPERI ALCIDE intersezione VIA AUSONIA;1;F;38,149899;13,33451
06/08/2022;11:10;VIA OLIO DI LINO nr. 20;0;C;38,080908;13,319704
06/08/2022;14:00;PIAZZA LEONE MARIA CARMELINA intersezione con VIA CARNEVALE SALVATORE;1;F;38,090624;13,359282
06/08/2022;15:00;VIA S.LORENZO nr. 288;1;F;38,165217;13,315978
06/08/2022;16:10;VIALE STRASBURGO intersezione con VIA BELGIO;2;F;38,151743;13,331145
06/08/2022;21:05;PIAZZA EINSTEIN ALBERT intersezione VIALE LEONARDO DA VINCI;0;C;38,127037;13,320646
06/08/2022;23:30;VIA SALAMONE MARINO SALVATORE intersezione con VIA ARCOLEO GIORGIO;1;F;38,107922;13,3605
06/08/2022;23:50;PIAZZA DON BOSCO intersezione con VIA MARCHESE DI ROCCAFORTE;1;F;38,144644;13,345667
07/08/2022;02:00;VIALE MICHELANGELO nr. 547;1;F;38,138291;13,324208
07/08/2022;03:00;VIA PIANO DELL'UCCIARDONE altezza carcere;0;C;38,131945;13,359664
07/08/2022;12:00;VIA LA MALFA UGO altezza (spec.) CIVICO N?62;1;F;38,160794;13,315342
07/08/2022;20:45;VIALE PERTINI SANDRO altezza VIA PATTI;1;F;38,174891;13,315832
08/08/2022;00:01;VIALE LAZIO intersezione con VIALE CAMPANIA;1;F;38,1429;13,3403
08/08/2022;08:15;VIA FERRARA FRANCESCO altezza (inters.) VIA PRINCIPE DI VILLAFRANCA;0;C;38,126023;13,351342
08/08/2022;08:40;VIA STABILE MARIANO altezza del civico 215;0;C;38,122299;13,355982
08/08/2022;11:30;LUNGOMARE COLOMBO CRISTOFORO intersezione con LARGO CARONIA ROBERTI SALV.;1;F;38,190864;13,344501
08/08/2022;15:00;VIA LULLI GIOVAN BATTISTA intersezione con VIA CATALANI ALFREDO;1;F;38,129299;13,338548
08/08/2022;15:13;VIA ROMA altezza P. San Domenico;1;F;38,118825;13,362515
08/08/2022;16:03;VIA ORETO intersezione con VIA ORSI PAOLO;0;C;38,094654;13,37522
08/08/2022;19:00;VIA DELL'ORSA MAGGIORE nr. 24;1;F;38,093863;13,3649
09/08/2022;08:30;ROTONDA VITTIME DI MONTAGNA LONGA 5 MAGGIO 1972 altezza VIA LA MALFA;0;C;38,166535;13,306244
09/08/2022;09:40;VIA SCIUTI GIUSEPPE altezza del civico 122;0;C;38,137372;13,340192
09/08/2022;11:20;VIA ROMA intersezione VIA NAPOLI;1;F;38,118074;13,362956
